anio,mes,dia,hora,minutos,segundos,mensaje,id_pager,numero_origen
2020,5,30,7,37,9,ante ipsum primis in faucibus orci luctus et,1,48634535
2020,4,25,12,42,9,"eleifend vitae, erat. Vivamus nisi.",2,48634530
2019,7,18,2,22,42,cursus,3,48634545
2019,2,16,22,46,47,at risus.,4,48634531
2019,4,23,17,38,21,Etiam,5,48634539
2020,5,27,18,13,21,nec ligula,6,48634545
2020,3,4,22,42,46,egestas,7,48634546
2019,5,13,17,53,22,vehicula risus.,8,48634538
2019,1,18,1,13,24,metus. Aenean sed,9,48634549
2020,12,8,3,41,11,nascetur ridiculus mus. Proin vel arcu eu odio tristique,10,48634540
2020,2,15,14,9,54,et netus et malesuada fames ac turpis egestas.,11,48634535
2019,10,21,23,7,26,"aptent taciti sociosqu ad litora torquent per conubia nostra,",12,48634536
2019,6,8,15,29,31,convallis dolor. Quisque tincidunt pede ac urna.,13,48634540
2020,8,28,5,9,38,Suspendisse,14,48634548
2019,10,1,15,49,52,"dolor elit, pellentesque a, facilisis non, bibendum",15,48634540
2019,12,5,12,33,40,"id, blandit at, nisi.",16,48634545
2020,12,3,5,15,57,quis arcu vel quam dignissim pharetra. Nam ac nulla.,17,48634550
2020,9,6,1,15,42,lacus. Etiam,18,48634534
2020,6,20,16,56,28,"egestas lacinia. Sed congue, elit sed consequat",19,48634530
2019,7,10,14,42,49,"a, scelerisque sed, sapien. Nunc",20,48634532
2019,12,25,9,43,42,vehicula,21,48634542
2019,7,6,20,11,39,"vitae, posuere at, velit. Cras lorem",22,48634537
2019,6,21,6,45,8,"non,",23,48634549
2020,4,28,5,3,3,Vestibulum accumsan neque et nunc. Quisque ornare tortor at,24,48634543
2020,2,6,9,53,51,Suspendisse dui. Fusce,25,48634546
2019,3,11,11,58,31,Donec,26,48634532
2019,3,4,3,57,45,molestie tortor nibh sit amet,27,48634542
2020,5,20,2,52,54,Fusce dolor,28,48634536
2019,10,25,24,36,43,malesuada fringilla est. Mauris eu turpis. Nulla aliquet.,29,48634529
2019,7,3,1,16,8,arcu. Curabitur ut odio vel est tempor bibendum.,30,48634537
2019,7,7,7,3,53,"dolor, nonummy ac, feugiat non, lobortis quis, pede.",31,48634535
2020,7,15,7,5,3,"ante blandit viverra. Donec tempus, lorem fringilla ornare",32,48634533
2019,11,25,23,30,52,ipsum primis in faucibus orci luctus et ultrices posuere,33,48634537
2020,11,13,6,8,47,vitae sodales nisi,34,48634543
2020,10,24,7,38,36,Pellentesque habitant morbi,35,48634530
2020,3,15,5,42,48,et risus. Quisque,36,48634547
2020,5,7,20,20,12,"auctor vitae, aliquet nec, imperdiet nec,",37,48634531
2019,12,9,2,59,33,"ligula tortor, dictum eu, placerat eget, venenatis",38,48634534
2020,5,19,8,28,55,purus gravida sagittis. Duis gravida. Praesent,39,48634550
2019,5,4,16,43,56,"ante blandit viverra. Donec tempus, lorem fringilla ornare",40,48634535
2020,6,27,15,46,48,inceptos hymenaeos. Mauris ut quam,41,48634541
2019,1,30,13,2,34,"accumsan convallis, ante lectus convallis",42,48634535
2020,1,27,12,47,49,Quisque ac,43,48634532
2019,4,3,10,14,9,cursus. Nunc mauris,44,48634544
2020,7,24,15,7,43,dignissim lacus. Aliquam rutrum lorem ac risus. Morbi,45,48634542
2020,5,10,1,51,55,libero. Proin sed turpis nec mauris blandit mattis. Cras,46,48634545
2020,10,8,7,15,20,pede ac urna.,47,48634540
2019,11,15,14,28,6,In nec,48,48634547
2020,3,7,21,49,17,eget lacus. Mauris non dui nec urna suscipit nonummy.,49,48634549
2020,6,24,13,35,6,iaculis,50,48634545
2020,7,19,12,14,37,enim. Etiam imperdiet dictum magna. Ut tincidunt orci quis,51,48634531
2020,2,14,7,8,46,"tortor, dictum eu, placerat eget,",52,48634550
2019,6,23,8,39,41,at pede. Cras vulputate velit eu sem. Pellentesque ut,53,48634531
2020,4,5,20,32,17,"sed, hendrerit a, arcu. Sed et libero. Proin mi. Aliquam",54,48634541
2020,9,6,14,12,47,sollicitudin commodo ipsum. Suspendisse non leo.,55,48634540
2020,7,13,24,19,18,sed consequat,56,48634542
2019,7,8,2,22,49,lobortis risus. In,57,48634543
2019,10,3,16,22,22,"mauris, rhoncus id, mollis nec, cursus a, enim. Suspendisse",58,48634542
2019,2,21,11,9,42,"Nunc laoreet lectus quis massa. Mauris vestibulum, neque sed",59,48634547
2020,3,12,8,9,20,"Quisque libero lacus, varius et,",60,48634538
2019,7,21,9,21,54,aptent taciti sociosqu ad,61,48634550
2020,3,8,3,5,48,laoreet ipsum.,62,48634547
2020,11,14,11,21,21,lacinia,63,48634546
2019,6,26,19,49,48,diam,64,48634537
2020,9,20,8,59,40,scelerisque neque. Nullam nisl. Maecenas malesuada fringilla est. Mauris eu,65,48634540
2020,2,20,14,10,49,magna. Phasellus,66,48634549
2020,4,10,8,12,34,"mauris,",67,48634549
2020,11,8,13,10,2,"auctor,",68,48634542
2019,12,11,23,37,1,"eleifend vitae, erat. Vivamus nisi. Mauris nulla.",69,48634529
2020,4,6,18,45,1,"libero. Integer in magna. Phasellus dolor elit, pellentesque a, facilisis",70,48634541
2019,6,20,20,48,46,arcu. Curabitur,71,48634549
2020,4,11,5,41,47,Donec egestas. Aliquam nec,72,48634528
2020,12,30,3,57,21,"pharetra, felis eget varius ultrices, mauris ipsum",73,48634546
2020,9,28,11,59,4,"est ac facilisis facilisis,",74,48634537
2020,10,22,7,34,30,eu metus. In lorem.,75,48634548
2020,11,30,23,46,57,eu odio tristique pharetra.,76,48634545
2019,3,8,5,30,32,lacus. Aliquam rutrum lorem ac risus. Morbi metus. Vivamus,77,48634537
2020,1,30,20,11,27,"Mauris molestie pharetra nibh. Aliquam ornare, libero at auctor",78,48634544
2019,1,30,20,59,56,"dictum eu, eleifend nec, malesuada ut, sem. Nulla interdum.",79,48634532
2020,7,1,8,57,48,accumsan interdum libero,80,48634545
2020,12,9,19,39,9,"lacus vestibulum lorem, sit amet ultricies sem magna nec",81,48634547
2019,10,6,15,4,49,sapien imperdiet ornare. In faucibus. Morbi vehicula. Pellentesque,82,48634548
2020,2,26,12,30,33,"faucibus ut, nulla.",83,48634547
2019,6,1,19,59,36,ac tellus. Suspendisse sed dolor. Fusce mi,84,48634545
2019,6,6,1,12,17,Nullam enim. Sed,85,48634533
2019,3,8,3,8,20,arcu. Vivamus sit amet,86,48634530
2020,2,18,2,55,30,"velit eget laoreet posuere, enim",87,48634542
2020,12,1,10,51,38,"Cras lorem lorem, luctus ut, pellentesque eget, dictum placerat,",88,48634531
2020,11,29,22,32,45,sociis natoque,89,48634548
2019,4,9,9,14,57,"magnis dis parturient montes, nascetur ridiculus",90,48634538
2019,3,15,3,18,21,felis,91,48634542
2020,2,20,12,24,38,"nec ante blandit viverra. Donec tempus, lorem fringilla ornare",92,48634535
2020,10,19,24,16,31,"rutrum, justo. Praesent luctus. Curabitur",93,48634543
2019,3,13,14,12,55,"mi felis, adipiscing fringilla, porttitor vulputate, posuere",94,48634534
2020,5,29,8,51,57,"rhoncus id, mollis nec, cursus a, enim. Suspendisse aliquet, sem",95,48634535
2020,12,12,20,53,27,"ac facilisis facilisis, magna tellus faucibus leo,",96,48634548
2020,9,23,4,10,20,"eleifend vitae, erat.",97,48634529
2019,10,11,16,18,50,"eget, volutpat ornare, facilisis eget, ipsum. Donec",98,48634539
2020,3,27,6,45,30,"dolor sit amet,",99,48634528
2019,3,27,15,31,3,"enim nisl elementum purus, accumsan interdum libero",100,48634530